{
  "event_id": "labour_day",
  "region_id": "RU-SVE",
  "grade_group": "9-11",
  "grade": 10,
  "pupils_count": 25,
  "duration_minutes": 60,
  "format": "interactive_lesson",
  "participants": {
    "teachers_count": 1,
    "parents_enabled": true,
    "parents_count": 4,
    "parent_roles": [
      "evaluator"
    ],
    "parent_audience_engagement": "none"
  },
  "resources": {
    "projector": false,
    "printer": false,
    "internet": false,
    "audio": null,
    "room": "classroom",
    "available_materials": [
      "paper",
      "markers"
    ],
    "extra_notes": null
  },
  "teacher_preferences": {
    "style": "research",
    "script_detail": "detailed",
    "difficulty": "advanced",
    "interaction_level": "high",
    "group_work": true,
    "preparation_effort": "standard",
    "notes": null
  },
  "generation": {
    "variants_count": 1,
    "language": "ru"
  }
}